{
  "name": "José María Cañas Plaza",
  "affiliation": "[RoboticsLabURJC](https://roboticslaburjc.github.io/) (Universidad Rey Juan Carlos)",
  "date": "2026-10-26",
  "title": "Programando robots en ingeniería desde el navegador web",
  "abstract": "La plataforma web Unibotics de programación de robots en ingeniería (https://unibotics.org) ofrece más de 30 retos robóticos utilizando software libre como ROS y el simulador Gazebo. Permite programar robots físicos y simulados desde el navegador web (https://www.youtube.com/@jderobot/videos), en C++, en Python, con BehaviorTrees, utilizando redes neuronales y bibliotecas estándar en la comunidad robótica internacional como MoveIt2, OpenCV, OMPL, Nav2, etc. Integra la colección de ejercicios RoboticsAcademy de la asociación JdeRobot (https://www.linkedin.com/company/jderobot) sobre robots móviles, robots de servicio, drones, conducción autónoma, robots industriales y visión artificial en robots, que es software abierto y desarrollado en comunidad. Además de describir brevemente su diseño, sus contenidos y las tecnologías que maneja se expondrán también los retos y dificultades de desarrollar software libre de alta calidad. Unibotics busca democratizar el acceso a la programación de robots y extender la comunidad robótica internacional, simplificando la instalación de dependencias robóticas y proporcionando un entorno de desarrollo que funciona en los principales sistemas operativos (Windows, Linux, MacOS). ",
  "bio": "José María Cañas Plaza, Universidad Rey Juan Carlos - José M. Cañas es ingeniero de telecomunicación y doctor por la U.Politécnica de Madrid (2003). Cofundó el RoboticsLab de la Universidad Rey Juan Carlos en el 2000, donde es Catedrático de Universidad. Fue miembro del Robot Learning Lab en Carnegie Mellon University (USA), investigó también en el Georgia Institute of Technology (USA) y el Instituto de Automática Industrial (CSIC). Investiga y publica con regularidad sobre robótica e inteligencia artificial en revistas científicas indexadas. Participa en y dirige proyectos competitivos, así como lidera proyectos de transferencia tecnológica en robótica a empresas. Imparte docencia en esas mismas áreas, habiendo dirigido 10 tesis doctorales (y actualmente otras 6 en curso) y 30 de master. Lidera la asociación de software libre en Robótica e IA JdeRobot, que ha participado durante más de una década en el Google Summer of Code. ",
  "skills": ["robótica", "web", "cloud", "educación"],
  "linkButtons": [
    {
      "href": "https://drive.google.com/file/d/1TBFqVsGsNtfE5E-a5dtLYFdsie-tP0Ze/view?usp=sharing",
      "label": "View slides"
    },
    {
      "href": "https://www.youtube.com/watch?v=6JvlBnJsP90",
      "label": "View demo 🎥"
    }
  ]
}
