{
  "$schema": "./next-speaker.schema.json",
  "name": "Mario Bermonti",
  "affiliation": "Ponce Health Sciences University, Puerto Rico",
  "date": "2026-11-30",
  "time": "4pm UK time",
  "location": "Online and in-person at [Mae Jemison Meeting Room, The Alan Turing Institute, British Library, 96 Euston Rd., London NW1 2DB](https://maps.app.goo.gl/qTqLBEaAYkA36Xqx5)"
}
