{
  "name": "Pablo Vicente Munuera",
  "affiliation": "University College London",
  "date": "2025-01-20",
  "title": "¿Cómo un movimiento de pole dance y la biología están conectados? Historias de un 'unofficial RSE'",
  "abstract": "¿Cómo un informático acaba haciendo biología? ¿Cuál es el papel del software en el campo de las ciencias naturales? Éstas son algunas de las preguntas que abordaré desde mi propia experiencia en esta charla. Hablaré de Escutoides. De software y equipos multidisciplinares. De conseguir autorías en artículos siendo computacional en un mundo de laboratorios. De open source y la obligación de llegar primero. También disfrutaréis de chistes malos y otras cosas absurdas que a veces hacen muy feliz.",
  "bio": "Soy un informático especializado en abordar problemas biológicos. Durante mi doctorado en la Universidad de Sevilla, bajo la supervisión de Luis M. Escudero, creé herramientas como EpiGraph para analizar imágenes de microscopía y estudiar la organización de los tejidos, descubriendo el Escutoide. Ahora, trabajo como investigador postdoctoral con Yanlan Mao en la University College London, desarrollando un modelo computacional 3D para entender cómo las fuerzas moldean tejidos. A lo largo de mi carrera, he colaborado con científicos de diversas disciplinas, liderando el desarrollo de herramientas como EpiGraph y supervisando proyectos de análisis de imágenes en 3D, siempre con un enfoque en open source y accesibles para la comunidad científica.",
  "skills": [
    "biología computacional",
    "análisis de imágenes",
    "open source"
  ]
}
