{
  "name": "Juliana Gómez Consuegra",
  "affiliation": "Ribbit AI & CDP",
  "date": "2026-03-09",
  "title": "Ribbit AI - Un “Shazam” Para Ranas",
  "abstract": "Ribbit AI es una aplicación web que utiliza el aprendizaje automático para la identificación de anuros (ranas y sapos) a través de vocalizaciones. Busca contribuir datos a repositorios de biodiversidad, con el fin de reducir la brecha de datos que existe en zonas altamente ricas en especies. Así mismo, tiene como objetivo empoderar a los científicos ciudadanos, y ayudar a los investigadores en el monitoreo ecológico. ",
  "bio": "<a href='https://julianagomezconsuegra-edi.netlify.app/' target='_blank' rel='noopener noreferrer' style='color: #E86C5E; font-weight: bold;'>Juliana Gómez Consuegra</a> se desempeña como especialista en calidad de datos en <a href='https://www.cdp.net/en' target='_blank' rel='noopener noreferrer' style='color: #E86C5E; font-weight: bold;'>CDP</a>, una ONG pionera en la divulgación de datos de impacto ambiental. Tiene una maestría en ciencia de datos de la Universidad de California en Berkeley, y una maestría y pregrado en biología de la Universidad de los Andes de Bogotá. Ribbit AI es la combinación de estas dos pasiones - los datos y las ranas; su especie de estudio. Adicionalmente, ha sido investigadora, docente y empresaria. El año pasado, pasó del desarrollo de software para el análisis de datos educativos, a la ciencia de datos como herramienta de mitigación del cambio climático. ",
  "skills": [
    "machine learning",
    "biodiversidad",
    "bioacústica"
  ],
  "linkButtons": [
    {
      "href": "https://youtu.be/8SBdCbtlcLw",
      "label": "View demo 🎥"
    },
    {
      "href": "https://drive.google.com/file/d/1P7hCDrdway_C9VsSR0h9M8h3y4aUS335/view?usp=sharing",
      "label": "View slides"
    }
  ]
}
