{
  "name": "Diego Alonso Álvarez",
  "affiliation": "Imperial College London",
  "date": "2024-12-09",
  "title": "Ingenieros de software de investigación: breve historia, cómo se hacen y a qué se dedican",
  "abstract": "El software ha sido aplicado a la ciencia y la investigación prácticamente desde la aparición de los ordenadores, pero ha sido sólo recientemente cuando su uso se ha extendido tanto y es tan común en todas las ramas del conocimiento, que se ha hecho imposible negar lo innegable: que el software es una pieza clave de los resultados de una investigación que debe recibir la atención, el cuidado y el valor que se merecen. En esta charla, hablaré de mi viaje a lo largo de mi carrera investigadora, cómo he acabado donde he acabado como RSE - historias que seguro que resuenan con las de muchos otros RSEs -, y que iniciativas tiene en marcha el RSE Team del Imperial para lograr precisamente eso, que el software producido en investigación sea de la máxima calidad, valorado y creando impacto.",
  "bio": "El Dr. Diego Alonso Álvarez es físico con 13 años de experiencia en investigación en el ámbito académico, incluido un doctorado en nanoestructuras de semiconductores e investigación postdoctoral sobre nuevos conceptos de energía solar y células solares. Se unió al equipo de Ingeniería de Software de Investigación (RSE Team) del Imperial College de Londres en noviembre de 2018 y ha contribuido a decenas de proyectos desde entonces. Diego es Fellow del Software Sustainability Institute, miembro de la Society of Research Software Engineering, y le entusiasma promover los beneficios de las buenas prácticas de desarrollo de software entre otros investigadores. Su experiencia se centra en la sostenibilidad y la accesibilidad del software, especialmente en relación con el desarrollo de interfaces gráficas de usuario para software de investigación. Diego dirige el RSE Team dentro de los Servicios de Computación de Investigación del Imperial desde noviembre de 2021.",
  "skills": [
    "buenas prácticas",
    "sostenibilidad",
    "física"
  ],
  "linkButtons": [
    {
      "href": "https://doi.org/10.5281/zenodo.14350523",
      "label": "View slides"
    }
  ]
}
