{
  "name": "Riva Quiroga",
  "affiliation": "Tabular",
  "date": "2025-05-27",
  "title": "Convertirse en RSE viniendo de cualquier parte",
  "abstract": "¿Cómo alguien que estudió Lengua y Literatura y trabajó 7 años como maestra de escuela termina dedicada a la ingeniería de software de investigación? En esta charla abordaremos cómo una trayectoria muy poco probable se vuelve posible gracias al apoyo de las comunidades de práctica. Discutiremos también el valor de estas comunidades para mantenerse al día sobre nuevos desarrollos y contaremos acerca de los planes para establecer el primer grupo de RSE en Latinoamérica.",
  "bio": "Riva Quiroga es RSE en Tabular, una pequeña empresa que ofrece servicios de desarrollo de software a proyectos de investigación. Es Fellow del Software Sustainability Institute y editora en Programming Historian. Es, además, una voluntaria serial: participa activamente en distintas iniciativas de las comunidades de R y Python, desde la organización de eventos a la traducción de materiales y documentación.",
  "skills": [
    "comunidades",
    "R",
    "humanidades digitales"
  ],
  "linkButtons": [
    {
      "href": "https://tinyurl.com/RSE-charlas-mayo-2025",
      "label": "View slides"
    }
  ]
}
