{
  "name": "Ivan Ogasawara",
  "affiliation": "Open Science Labs",
  "date": "2025-12-15",
  "title": "Equipos de alto rendimiento humano: bienestar, colaboración y resultados",
  "abstract": "En proyectos y equipos de RSE, y en el desarrollo de software en general, suele ponerse el foco casi exclusivamente en las hard skills (conocimientos y habilidades técnicas), dejando en segundo plano las soft skills (habilidades personales, interpersonales y sociales). En muchas organizaciones se recurre a bonificaciones y programas basados en métricas con la intención de “forzar” la productividad o la “motivación”. En esta charla compartiré ideas y experiencias para mejorar la cultura de los equipos de trabajo y crear entornos que fomenten la colaboración, el bienestar y un alto rendimiento sostenible. ",
  "bio": "Ivan es RSE senior y líder técnico con más de 22 años de trayectoria en sistemas backend, plataformas de datos, DevOps, ML/RAG y compiladores. Ha trabajado con múltiples lenguajes (como Python, C/C++, JavaScript, Java, R y Rust) y es fundador de <a href='https://opensciencelabs.org/' target='_blank' rel='noopener noreferrer' style='color: #E86C5E; font-weight: bold;'>Open Science Labs</a>. Colaboró como asesor en comunidades como <a href='https://www.pyopensci.org/' target='_blank' rel='noopener noreferrer' style='color: #E86C5E; font-weight: bold;'>pyOpenSci</a> y <a href='https://www.cos.io/products/osf' target='_blank' rel='noopener noreferrer' style='color: #E86C5E; font-weight: bold;'>Open Science Framework</a>, y es investigador independiente afiliado a <a href='https://igdore.org/' target='_blank' rel='noopener noreferrer' style='color: #E86C5E; font-weight: bold;'>IGDORE - Institute for Globally Distributed Open Research and Education</a>.",
  "skills": [
    "soft skills",
    "colaboración",
    "bienestar"
  ]
}
